{
  "name": "button",
  "title": "Button",
  "family": "buttons",
  "description": "Primary, secondary, tertiary, and destructive actions in three sizes, with loading and icon-only modes.",
  "status": {
    "css": {
      "state": "latest",
      "version": "0.1.0"
    },
    "react": {
      "state": "latest",
      "version": "0.1.0"
    },
    "figma": {
      "state": "future"
    }
  },
  "dependencies": [
    "state-layer",
    "spinner"
  ],
  "files": [
    {
      "source": "packages/css/src/button.css",
      "target": "styles/button.css"
    },
    {
      "source": "packages/react/src/button.tsx",
      "target": "components/button.tsx"
    },
    {
      "source": "packages/react/src/cx.ts",
      "target": "lib/cx.ts"
    }
  ],
  "tier": "free",
  "behavior": {
    "primitive": "getButtonProps",
    "summary": "Activation guarding and disabled/busy semantics, independent of React and of any styling.",
    "decisions": [
      {
        "decision": "`aria-disabled` instead of the native `disabled` attribute",
        "why": "A natively disabled button leaves the tab order and stops being announced, so users navigating by keyboard or screen reader cannot discover that the action exists. Activation is blocked in the click guard instead."
      },
      {
        "decision": "`loading` implies inert",
        "why": "One flag covers both halves of what callers actually want — show progress, and refuse a second click — so the two cannot be set inconsistently."
      }
    ]
  },
  "props": {
    "variant": {
      "summary": "Which action tier this button occupies, and therefore how loud it is.",
      "use": [
        "`primary` for the single highest-priority action in a view — one per view.",
        "`secondary` for a supporting action shown beside a primary one.",
        "`tertiary` for low-emphasis actions in dense areas, like a row action.",
        "`destructive` for an action that deletes or revokes something."
      ],
      "dont": [
        "Two `primary` buttons in one view — the tier is a claim about priority, and two claims cancel out.",
        "`destructive` for merely irreversible actions like Submit; it means data is lost."
      ],
      "a11y": "Variant is visual only. A destructive action still needs its own confirmation step — colour is not a warning."
    },
    "size": {
      "summary": "Control height and text size, from the `size.control.*` scale.",
      "use": [
        "`md` everywhere by default.",
        "`sm` inside dense rows, toolbars, and table cells.",
        "`lg` for a single prominent call to action on a marketing or empty-state surface."
      ],
      "dont": [
        "Shrinking to `sm` to fit a cramped layout — fix the layout budget instead.",
        "Setting font-size or height yourself; the size prop is the only supported way to change either."
      ]
    },
    "disabled": {
      "summary": "Blocks activation while keeping the button focusable and announced.",
      "use": [
        "An action that is unavailable for a reason the surrounding UI already explains."
      ],
      "dont": [
        "Hiding why an action is unavailable — pair it with visible helper text or a tooltip.",
        "Form validation gating, where an inline error explains more than a dead button does."
      ],
      "conflicts": [
        "loading"
      ],
      "a11y": "Emits `aria-disabled`, never the native `disabled` attribute: the control stays in the tab order and discoverable by screen readers, and activation is blocked in the primitive's click guard."
    },
    "loading": {
      "summary": "Shows a spinner and refuses activation while an operation is in flight.",
      "use": [
        "Async work started by this button, so the same control reports its own progress."
      ],
      "dont": [
        "Page-level or unrelated loading — that belongs to the region that is actually loading.",
        "Swapping the label to 'Loading…' as well; the spinner and `aria-busy` already say it, and a changing label loses the action's name."
      ],
      "conflicts": [
        "disabled"
      ],
      "a11y": "Emits `aria-busy` alongside `aria-disabled`, so assistive technology hears both that the control is working and that it will not respond yet."
    },
    "iconOnly": {
      "summary": "Square button carrying an icon and no visible text.",
      "use": [
        "Dense toolbars and row actions where the icon is unambiguous and repeated.",
        "Icon-only buttons in this system: there is no separate `IconButton` component, and one would be a second way to do what this prop already does."
      ],
      "dont": [
        "Any action whose icon is not already conventional — an unlabelled novel icon is unreadable.",
        "Passing text children as well; the square sizing assumes a single glyph."
      ],
      "a11y": "You MUST pass `aria-label`. Nothing in the component supplies an accessible name when there is no visible text."
    }
  },
  "usage": [
    {
      "case": "Primary action with async work",
      "when": "The most common pairing: one primary button that owns its own progress.",
      "example": "<Button loading={saving} onClick={save}>Save changes</Button>",
      "notes": "`loading` blocks repeat activation on its own — don't also guard with `disabled`."
    },
    {
      "case": "Destructive action in a confirmation",
      "when": "Deleting something, with the safe action given equal visual weight beside it.",
      "example": "<Button variant=\"destructive\" onClick={remove}>Delete project</Button>"
    },
    {
      "case": "Icon-only row action",
      "when": "A dense table row where a labelled button would not fit.",
      "example": "<Button variant=\"tertiary\" size=\"sm\" iconOnly aria-label=\"Remove row\">×</Button>",
      "notes": "Without `aria-label` this button has no accessible name at all."
    }
  ],
  "tokens": {
    "primary": {
      "summary": "The single highest-priority action in a view.",
      "tokens": {
        "background": "theme.accent-role.bg",
        "color": "theme.fg.on-accent",
        "height": "size.control.md",
        "padding-inline": "space.control.padding-inline.md",
        "gap": "space.gap.xs",
        "border-radius": "radius.element",
        "font-size": "type.control.size.md",
        "font-weight": "type.control.weight",
        "line-height": "type.control.line-height.md",
        "transition-duration": "motion.interactive.duration",
        "transition-timing-function": "motion.interactive.easing",
        "outline (focus-visible)": "focus.ring-width solid theme.focus-ring, offset focus.ring-offset",
        "hover/press": "compose the .ds-state-layer class — do not swap the background"
      }
    },
    "secondary": {
      "summary": "A supporting action shown next to a primary one.",
      "tokens": {
        "background": "theme.secondary-role.bg",
        "color": "theme.secondary-role.fg",
        "border-color": "theme.secondary-role.border",
        "height": "size.control.md",
        "border-radius": "radius.element",
        "hover/press": "compose the .ds-state-layer class"
      }
    },
    "destructive": {
      "summary": "An action that deletes or revokes something.",
      "tokens": {
        "background": "theme.danger-role.bg",
        "color": "theme.fg.on-accent",
        "height": "size.control.md",
        "border-radius": "radius.element",
        "hover/press": "compose the .ds-state-layer class"
      }
    }
  }
}
